{
  "comment": "",
  "creator": [
    "Marian Klamer"
  ],
  "language": "lmh_li",
  "source": [
    "j:/ResearchData/HUM/LUCL-KlamerVICI/Lesser Sunda Database/LMH_LI_MK_2016_Typological_Questionnaire_Lamaholot_Lewoingu.xlsx"
  ],
  "references": [
    "Nishiyama, Kunio and Herman Kelen (2007). A grammar of Lamaholot, Eastern Indonesia. Muenchen: LINCOM Europa. ",
    "Klamer, Marian. 2012. Papuan-Austronesian language contact:\nAlorese from an areal perspective. In: Nick Evans and Marian Klamer (eds.). Melanesian Languages on the Edge of Asia: Challenges for the 21st Century [Language Documentation & Conservation Special Publication No. 5], 72-108",
    "Kinship task of Lamaholot Lewoingu, collected in May 2015 by Marian Klamer in East Flores."
  ],
  "abstract": "Typological features of lmh_li. Coded by Marian Klamer following ['j:/ResearchData/HUM/LUCL-KlamerVICI/Lesser Sunda Database/LMH_LI_MK_2016_Typological_Questionnaire_Lamaholot_Lewoingu.xlsx', 'Nishiyama, Kunio and Herman Kelen (2007). A grammar of Lamaholot, Eastern Indonesia. Muenchen: LINCOM Europa. ', 'Klamer, Marian. 2012. Papuan-Austronesian language contact:\\nAlorese from an areal perspective. In: Nick Evans and Marian Klamer (eds.). Melanesian Languages on the Edge of Asia: Challenges for the 21st Century [Language Documentation & Conservation Special Publication No. 5], 72-108', 'Kinship task of Lamaholot Lewoingu, collected in May 2015 by Marian Klamer in East Flores.'].",
  "created": [
    "July 2016"
  ],
  "id": "lmh_li",
  "name": "LMH_LI_MK_2016_Typological_Questionnaire_Lamaholot_Lewoingu.xlsx"
}